{
  "schema_version": "1.0",
  "record": {
    "id": "shu-1977-self-similar-collapse",
    "version": "0.5",
    "status": "draft",
    "created": "2026-10-21",
    "updated": "2026-10-30",
    "contributors": {
      "status": "not_reported",
      "note": "Contributor names and roles have not yet been formally recorded."
    },
    "reviewers": {
      "status": "not_yet_confirmed",
      "note": "Independent review has not yet been documented."
    }
  },
  "publication": {
    "title": "Self-Similar Collapse of Isothermal Spheres and Star Formation",
    "authors": "F. H. Shu",
    "year": 1977,
    "venue": "The Astrophysical Journal, 214, 488-497",
    "doi": "10.1086/155274",
    "publication_url": "https://doi.org/10.1086/155274",
    "published_code_or_data_url": {
      "status": "not_reported",
      "note": "A publication-associated source-code or numerical-data archive has not been confirmed."
    }
  },
  "target": {
    "description": "Numerical reproduction and cross-checking of the similarity solutions for the self-similar collapse of isothermal spheres described by Shu (1977).",
    "scope": "Primary quantitative cross-check: the final mass parameter for the A=2.4 collapse solution computed with fixed-step RK4 and adaptive RK45. The published Table 1 value is rounded and is not a high-precision reference solution. Taylor-series and spectral calculations are supplementary and have different evidence status.",
    "reference_results": [
      "Shu (1977), Table 1 reports a mass parameter of 1.88, rounded to two decimal places; this value should not be treated as a high-precision benchmark."
    ]
  },
  "verification": {
    "workflow_stage": "numerically_cross_checked",
    "scientific_verdict": "partial_numerical_reproduction",
    "verdict_justification": "For A=2.4, fixed-step RK4 and adaptive RK45 report central mass parameters of 1.885209332164 and 1.885209332537, respectively, with a relative difference of approximately 1.98e-10. Their reported profile differences on a common logarithmic grid are small. The higher-order Taylor implementation also passes its automated endpoint-mass comparison against RK45: at x=0.001, the Taylor and RK45 endpoint masses are 1.8852400343916835 and 1.8852400344047633, with absolute difference 1.3079759497713894e-11 against an allowed absolute difference of 1e-8. This endpoint comparison is not a comparison of extrapolated central mass parameters. The RK45 automated test also passes against its configured reference. These results support numerical cross-checking across different integration strategies, but the methods share the governing equations and related asymptotic assumptions. Shu's published mass parameter 1.88 is rounded. The spectral calculation remains exploratory. The overall verdict is partial numerical reproduction, not complete independent scientific verification.",
    "review_scope": {
      "status": "not_yet_confirmed",
      "note": "No independent review scope has been recorded."
    },
    "review_date": {
      "status": "not_applicable",
      "note": "Independent review has not yet been completed."
    }
  },
  "methods": [
    {
      "name": "Fixed-step fourth-order Runge-Kutta (RK4)",
      "role": "primary_reproduction",
      "implementation": "papers/1977Shu/code/shu1977_rk4.m",
      "independence_assessment": "Provides a fixed-step integration that can be compared with adaptive RK45. It is not mathematically independent of RK45 because both use the same governing equations and related initial asymptotic assumptions.",
      "settings": {
        "parameter_A": 2.4,
        "step_size": 1e-05,
        "x_start": 10.0,
        "x_end": 0.001,
        "integration_method": "Fixed-step RK4"
      },
      "results": [
        {
          "quantity": "Final mass parameter m0",
          "value": 1.885209332164,
          "source": "computed",
          "comparison_scope": "A=2.4 collapse solution; RK4 integration from x=10 to x=0.001 with step size 1e-5.",
          "notes": "Computed result reported by the repository's numerical run."
        }
      ]
    },
    {
      "name": "Adaptive Runge-Kutta (RK45; ode45)",
      "role": "cross_check",
      "implementation": "papers/1977Shu/code/shu1977_rk45.m",
      "independence_assessment": "Provides an adaptive integration cross-check against fixed-step RK4. The integrator differs, but the governing equations and related initial asymptotic assumptions are shared; this is not a fully independent formulation.",
      "settings": {
        "parameter_A": 2.4,
        "relative_tolerance": 1e-11,
        "absolute_tolerance": 1e-13,
        "maximum_step": 0.005,
        "x_start": 10.0,
        "x_end": 0.001,
        "integration_method": "ode45"
      },
      "results": [
        {
          "quantity": "Final mass parameter m0",
          "value": 1.885209332537,
          "source": "computed",
          "comparison_scope": "A=2.4 collapse solution; adaptive RK45 integration from x=10 to x=0.001.",
          "notes": "Computed result reported by the repository's numerical run."
        },
        {
          "quantity": "Absolute difference in final mass parameter between RK4 and RK45",
          "value": 3.73e-10,
          "source": "derived",
          "comparison_scope": "Absolute difference between the reported RK4 and RK45 final mass values.",
          "notes": "Derived from the displayed rounded results; exact difference from the full-precision outputs should be taken from the cross-check output."
        },
        {
          "quantity": "Relative difference in final mass parameter between RK4 and RK45",
          "value": 1.977996e-10,
          "source": "derived",
          "comparison_scope": "Relative difference between the reported RK4 and RK45 final mass values.",
          "notes": "Reported relative mass difference."
        },
        {
          "quantity": "Maximum relative profile difference in alpha",
          "value": 1.188383e-08,
          "source": "derived",
          "comparison_scope": "RK4 versus RK45 on a common logarithmic grid using pchip interpolation.",
          "notes": "Reported maximum relative difference."
        },
        {
          "quantity": "Maximum relative profile difference in v",
          "value": 2.026988e-09,
          "source": "derived",
          "comparison_scope": "RK4 versus RK45 on a common logarithmic grid using pchip interpolation.",
          "notes": "Reported maximum relative difference."
        }
      ]
    },
    {
      "name": "Higher-order Taylor-series integration",
      "role": "cross_check",
      "implementation": "papers/1977Shu/code/shu1977_taylor.m",
      "independence_assessment": "Uses a different numerical integration strategy from RK45 and provides an automated endpoint-mass cross-check. The methods still share the governing equations and related asymptotic assumptions, so this is numerical cross-checking rather than an independent mathematical formulation.",
      "settings": {
        "parameter_A": 2.4,
        "x_start": 10.0,
        "x_end": 0.001,
        "Taylor_order": 30,
        "Taylor_tolerance": 1e-14,
        "RK45_relative_tolerance": 1e-11,
        "RK45_absolute_tolerance": 1e-13,
        "RK45_maximum_step": 0.005,
        "test_status": "pass",
        "comparison_quantity": "Endpoint mass at x=0.001; not extrapolated m0"
      },
      "results": [
        {
          "quantity": "Taylor endpoint mass",
          "value": 1.8852400343916835,
          "source": "computed",
          "comparison_scope": "A=2.4; Taylor integration from x=10 to x=0.001.",
          "notes": "Reported by papers/1977Shu/results/taylor_verification.json."
        },
        {
          "quantity": "RK45 endpoint mass in Taylor comparison",
          "value": 1.8852400344047633,
          "source": "computed",
          "comparison_scope": "A=2.4; RK45 integration from x=10 to x=0.001.",
          "notes": "This is the endpoint mass, not the extrapolated central mass parameter."
        },
        {
          "quantity": "Absolute difference in endpoint mass, Taylor versus RK45",
          "value": 1.3079759497713894e-11,
          "source": "derived",
          "comparison_scope": "Endpoint mass comparison at x=0.001.",
          "absolute_error": 1.3079759497713894e-11,
          "tolerance": 1e-08,
          "notes": "Automated test passed; not a comparison of extrapolated m0 values."
        },
        {
          "quantity": "RK45 extrapolated central mass parameter m0",
          "value": 1.8852093325372912,
          "source": "computed",
          "comparison_scope": "Informational value reported by the Taylor verification test.",
          "notes": "Not compared with Taylor endpoint mass."
        }
      ]
    },
    {
      "name": "Chebyshev spectral collocation",
      "role": "exploratory",
      "implementation": {
        "status": "not_yet_confirmed",
        "note": "Exploratory spectral implementation and its convergence evidence require separate review; it is not part of the primary verification verdict."
      },
      "independence_assessment": "Spectral collocation is a distinct numerical approach from time-marching integration, but the reported higher-resolution stagnation prevents treating the results as a verified independent reference.",
      "settings": {
        "parameter_A": 2.4,
        "reported_resolution_values": [
          240,
          320
        ],
        "status": "Exploratory; N=320 was reported to stagnate."
      },
      "results": [
        {
          "quantity": "Final mass parameter m0 at N=240",
          "value": 1.885166801206,
          "source": "computed",
          "comparison_scope": "Exploratory spectral collocation calculation for A=2.4.",
          "notes": "Previously reported as converged at N=240; requires independent inspection of the spectral run and convergence criteria."
        },
        {